{
  "eventId": "8c9d0e1f-2a3b-4c4d-9e5f-708192a3b4c4",
  "eventType": "prestador.seleccionado",
  "schemaVersion": 1,
  "occurredAt": "2026-10-26T15:10:00Z",
  "producer": "ms-services",
  "aggregate": {
    "type": "ServiceRequest",
    "id": "6f1c2a3b-4d5e-4f60-8a71-92b3c4d5e6f7",
    "sequence": 4
  },
  "correlationId": "6f1c2a3b-4d5e-4f60-8a71-92b3c4d5e6f7",
  "actor": {
    "userId": "0a1b2c3d-4e5f-4a6b-8c7d-9e0f1a2b3c4d",
    "role": "CLIENT"
  },
  "data": {
    "serviceRequestId": "6f1c2a3b-4d5e-4f60-8a71-92b3c4d5e6f7",
    "clientId": "0a1b2c3d-4e5f-4a6b-8c7d-9e0f1a2b3c4d",
    "selectedApplicationId": "4e5f6a7b-8c9d-4e0f-9a1b-3c4d5e6f7081",
    "selectedProviderId": "2c3d4e5f-6a7b-4c8d-9e0f-1a2b3c4d5e6f",
    "selectedProposedPrice": {
      "amount": "98500.50",
      "currency": "COP"
    },
    "rejectedApplicationIds": [
      "3d4e5f6a-7b8c-4d9e-8f0a-2b3c4d5e6f70"
    ],
    "selectedAt": "2026-10-26T15:10:00Z",
    "status": "PROVIDER_SELECTED"
  }
}
