{
  "eventId": "8c9d0e1f-2a3b-4c4d-9e5f-708192a3b4c2",
  "eventType": "postulacion.registrada",
  "schemaVersion": 1,
  "occurredAt": "2026-10-26T14:20:00Z",
  "producer": "ms-services",
  "aggregate": {
    "type": "ServiceRequest",
    "id": "6f1c2a3b-4d5e-4f60-8a71-92b3c4d5e6f7",
    "sequence": 2
  },
  "correlationId": "6f1c2a3b-4d5e-4f60-8a71-92b3c4d5e6f7",
  "actor": {
    "userId": "1b2c3d4e-5f6a-4b7c-8d9e-0f1a2b3c4d5e",
    "role": "PROFESSIONAL"
  },
  "data": {
    "applicationId": "3d4e5f6a-7b8c-4d9e-8f0a-2b3c4d5e6f70",
    "serviceRequestId": "6f1c2a3b-4d5e-4f60-8a71-92b3c4d5e6f7",
    "providerId": "1b2c3d4e-5f6a-4b7c-8d9e-0f1a2b3c4d5e",
    "status": "APPLIED",
    "proposedPrice": {
      "amount": "150000.00",
      "currency": "COP"
    },
    "appliedAt": "2026-10-26T14:20:00Z"
  }
}
