{
  "eventId": "8c9d0e1f-2a3b-4c4d-9e5f-708192a3b4c5",
  "eventType": "cotizacion.enviada",
  "schemaVersion": 1,
  "occurredAt": "2026-10-26T16:00:00Z",
  "producer": "ms-services",
  "aggregate": {
    "type": "ServiceRequest",
    "id": "6f1c2a3b-4d5e-4f60-8a71-92b3c4d5e6f7",
    "sequence": 5
  },
  "correlationId": "6f1c2a3b-4d5e-4f60-8a71-92b3c4d5e6f7",
  "actor": {
    "userId": "2c3d4e5f-6a7b-4c8d-9e0f-1a2b3c4d5e6f",
    "role": "PROFESSIONAL"
  },
  "data": {
    "quotationId": "5f6a7b8c-9d0e-4f1a-8b2c-4d5e6f708192",
    "serviceRequestId": "6f1c2a3b-4d5e-4f60-8a71-92b3c4d5e6f7",
    "clientId": "0a1b2c3d-4e5f-4a6b-8c7d-9e0f1a2b3c4d",
    "providerId": "2c3d4e5f-6a7b-4c8d-9e0f-1a2b3c4d5e6f",
    "price": {
      "amount": "120000.00",
      "currency": "COP"
    },
    "scope": "Cambio de la tubería del lavamanos y revisión de fugas en el baño principal",
    "conditions": "Materiales incluidos. Garantía de 30 días sobre la mano de obra",
    "agreedAt": "2026-10-28T15:00:00Z",
    "validUntil": "2026-10-27T23:59:00Z",
    "sentAt": "2026-10-26T16:00:00Z",
    "status": "SENT",
    "replacedQuotations": [],
    "revision": 1
  }
}
